[
  {
    "agency_id": "accident-compensation-corporation",
    "name": "Accident Compensation Corporation (Te Kaporeihana Āwhina Hunga Whara)",
    "type": "Crown Agent",
    "portfolio": "ACC",
    "official_website": "https://www.acc.co.nz",
    "status": "active",
    "social_profiles": {
      "facebook": {
        "handle": "ACCNewZealand",
        "url": "https://www.facebook.com/ACCNewZealand",
        "status": "active",
        "discovered_at": "2026-06"
      },
      "linkedin": {
        "handle": "ACC New Zealand",
        "url": "https://www.linkedin.com/company/acc-new-zealand",
        "status": "active",
        "discovered_at": "2026-06"
      },
      "instagram": {
        "handle": "accnewzealand",
        "url": "https://www.instagram.com/accnewzealand",
        "status": "active",
        "discovered_at": "2026-06"
      },
      "youtube": {
        "handle": "ACC New Zealand",
        "url": "https://www.youtube.com/@accnz",
        "status": "active",
        "discovered_at": "2026-06"
      }
    }
  },
  {
    "agency_id": "accreditation-council",
    "name": "Accreditation Council (International Accreditation NZ / Telarc)",
    "type": "Autonomous Crown Entity",
    "portfolio": "Economic Development",
    "official_website": "https://www.accreditation.co.nz",
    "status": "active",
    "social_profiles": {}
  },
  {
    "agency_id": "airways-nz",
    "name": "Airways New Zealand",
    "type": "SOE",
    "portfolio": "Transport",
    "official_website": "https://www.airways.co.nz",
    "status": "active",
    "social_profiles": {
      "linkedin": {
        "handle": "Airways New Zealand",
        "url": "https://www.linkedin.com/company/airways-new-zealand",
        "status": "active",
        "discovered_at": "2026-06"
      }
    }
  },
  {
    "agency_id": "animal-control-products",
    "name": "Animal Control Products (Pestoff)",
    "type": "SOE",
    "portfolio": "Agriculture",
    "official_website": "https://www.pestoff.co.nz",
    "status": "active",
    "social_profiles": {}
  },
  {
    "agency_id": "antarctica-nz",
    "name": "Antarctica New Zealand",
    "type": "Crown Agent",
    "portfolio": "Foreign Affairs",
    "official_website": "https://www.antarcticanz.govt.nz",
    "status": "active",
    "social_profiles": {
      "linkedin": {
        "handle": "Antarctica New Zealand",
        "url": "https://www.linkedin.com/company/antarctica-new-zealand",
        "status": "active",
        "discovered_at": "2026-06"
      },
      "facebook": {
        "handle": "AntarcticaNZ",
        "url": "https://www.facebook.com/AntarcticaNZ",
        "status": "active",
        "discovered_at": "2026-06"
      },
      "instagram": {
        "handle": "antarcticanz",
        "url": "https://www.instagram.com/antarcticanz",
        "status": "active",
        "discovered_at": "2026-06"
      },
      "x": {
        "handle": "AntarcticaNZ",
        "url": "https://x.com/AntarcticaNZ",
        "status": "active",
        "discovered_at": "2026-06"
      },
      "youtube": {
        "handle": "AntarcticaNZ",
        "url": "https://www.youtube.com/@AntarcticaNZ",
        "status": "active",
        "discovered_at": "2026-06"
      }
    }
  },
  {
    "agency_id": "ara-institute-of-canterbury",
    "name": "Ara Institute of Canterbury",
    "type": "ITP/Polytechnic",
    "portfolio": "Education",
    "official_website": "https://www.ara.ac.nz",
    "status": "active",
    "social_profiles": {
      "facebook": {
        "handle": "AraInstitute",
        "url": "https://www.facebook.com/AraInstitute",
        "status": "active",
        "discovered_at": "2026-06"
      },
      "linkedin": {
        "handle": "Ara Institute of Canterbury",
        "url": "https://www.linkedin.com/school/ara-institute-of-canterbury",
        "status": "active",
        "discovered_at": "2026-06"
      },
      "instagram": {
        "handle": "arainstitute",
        "url": "https://www.instagram.com/arainstitute",
        "status": "active",
        "discovered_at": "2026-06"
      },
      "youtube": {
        "handle": "AraInstitute",
        "url": "https://www.youtube.com/@AraInstitute",
        "status": "active",
        "discovered_at": "2026-06"
      }
    }
  },
  {
    "agency_id": "ashburton-district-council",
    "name": "Ashburton District Council",
    "type": "District Council",
    "portfolio": "Local Government",
    "official_website": "https://www.ashburtondc.govt.nz",
    "status": "active",
    "social_profiles": {
      "facebook": {
        "handle": "AshburtonDistrictCouncil",
        "url": "https://www.facebook.com/AshburtonDistrictCouncil",
        "status": "active",
        "discovered_at": "2026-06"
      }
    }
  },
  {
    "agency_id": "asurequality",
    "name": "AsureQuality (Kaitiaki Kai)",
    "type": "SOE",
    "portfolio": "Agriculture",
    "official_website": "https://www.asurequality.com",
    "status": "active",
    "social_profiles": {
      "linkedin": {
        "handle": "AsureQuality",
        "url": "https://www.linkedin.com/company/asurequality",
        "status": "active",
        "discovered_at": "2026-06"
      }
    }
  },
  {
    "agency_id": "auckland-council",
    "name": "Auckland Council (Te Kaunihera o Tāmaki Makaurau)",
    "type": "Unitary Authority",
    "portfolio": "Local Government",
    "official_website": "https://www.aucklandcouncil.govt.nz",
    "status": "active",
    "social_profiles": {
      "facebook": {
        "handle": "aklcouncil",
        "url": "https://www.facebook.com/aklcouncil",
        "status": "active",
        "discovered_at": "2026-06"
      },
      "x": {
        "handle": "AklCouncil",
        "url": "https://x.com/AklCouncil",
        "status": "active",
        "discovered_at": "2026-06"
      },
      "instagram": {
        "handle": "aklcouncil",
        "url": "https://www.instagram.com/aklcouncil/",
        "status": "active",
        "discovered_at": "2026-06"
      },
      "linkedin": {
        "handle": "Auckland Council",
        "url": "https://www.linkedin.com/company/auckland-council",
        "status": "active",
        "discovered_at": "2026-06"
      }
    }
  },
  {
    "agency_id": "auckland-light-rail",
    "name": "Auckland Light Rail Limited",
    "type": "Crown Entity Company",
    "portfolio": "Transport",
    "official_website": "https://www.aucklandlightrail.co.nz",
    "status": "active",
    "social_profiles": {}
  },
  {
    "agency_id": "aut-university",
    "name": "AUT University (Te Wānanga Aronui o Tāmaki Makau Rau)",
    "type": "University",
    "portfolio": "Education",
    "official_website": "https://www.aut.ac.nz",
    "status": "active",
    "social_profiles": {
      "facebook": {
        "handle": "AUTUniversity",
        "url": "https://www.facebook.com/AUTUniversity",
        "status": "active",
        "discovered_at": "2026-06"
      },
      "linkedin": {
        "handle": "Auckland University of Technology",
        "url": "https://www.linkedin.com/school/auckland-university-of-technology",
        "status": "active",
        "discovered_at": "2026-06"
      },
      "instagram": {
        "handle": "autuni",
        "url": "https://www.instagram.com/autuni",
        "status": "active",
        "discovered_at": "2026-06"
      },
      "youtube": {
        "handle": "AUTUni",
        "url": "https://www.youtube.com/@AUTUni",
        "status": "active",
        "discovered_at": "2026-06"
      }
    }
  },
  {
    "agency_id": "bay-of-plenty-regional-council",
    "name": "Bay of Plenty Regional Council (Toi Moana)",
    "type": "Regional Council",
    "portfolio": "Local Government",
    "official_website": "https://www.boprc.govt.nz",
    "status": "active",
    "social_profiles": {
      "facebook": {
        "handle": "BayofPlentyRegionalCouncil",
        "url": "https://www.facebook.com/BayofPlentyRegionalCouncil",
        "status": "active",
        "discovered_at": "2026-06"
      }
    }
  },
  {
    "agency_id": "beehive-nz",
    "name": "Beehive NZ",
    "type": "Other",
    "portfolio": "Executive",
    "official_website": "https://www.beehive.govt.nz",
    "status": "active",
    "social_profiles": {
      "bluesky": {
        "handle": "beehivenz.bsky.social",
        "url": "https://bsky.app/profile/beehivenz.bsky.social",
        "status": "active"
      }
    }
  },
  {
    "agency_id": "broadcasting-standards-authority",
    "name": "Broadcasting Standards Authority (Te Mana Whanonga Kaipāho)",
    "type": "Independent Crown Entity",
    "portfolio": "Broadcasting",
    "official_website": "https://www.bsa.govt.nz",
    "status": "active",
    "social_profiles": {
      "x": {
        "handle": "BSA_NZ",
        "url": "https://x.com/BSA_NZ",
        "status": "active"
      }
    }
  },
  {
    "agency_id": "buller-district-council",
    "name": "Buller District Council",
    "type": "District Council",
    "portfolio": "Local Government",
    "official_website": "https://www.bullerdc.govt.nz",
    "status": "active",
    "social_profiles": {
      "facebook": {
        "handle": "BullerDistrictCouncil",
        "url": "https://www.facebook.com/BullerDistrictCouncil",
        "status": "active",
        "discovered_at": "2026-06"
      }
    }
  },
  {
    "agency_id": "callaghan-innovation",
    "name": "Callaghan Innovation (Te Pokapū Auaha)",
    "type": "Crown Agent",
    "portfolio": "Economic Development, Science and Innovation",
    "official_website": "https://www.callaghaninnovation.govt.nz",
    "status": "active",
    "social_profiles": {
      "linkedin": {
        "handle": "Callaghan Innovation",
        "url": "https://www.linkedin.com/company/callaghan-innovation",
        "status": "active",
        "discovered_at": "2026-06"
      },
      "facebook": {
        "handle": "Callaghan Innovation",
        "url": "https://www.facebook.com/CallaghanInnovation",
        "status": "active",
        "discovered_at": "2026-06"